image,summary_wikipedia,eventLabel,date,event,label,article,participants,article_en
http://commons.wikimedia.org/wiki/Special:FilePath/Pedro%20I%20of%20Castilla.jpg,"The War of the Two Peters (Spanish: La Guerra de los Dos Pedros, Catalan: Guerra dels dos Peres) was fought from 1356 to 1375 between the kingdoms of Castile and Aragon. The conflict was a struggle between two claimants to the throne of Castile, Peter of Castile and Peter IV of Aragon. The former Peter was supported by England and several English nobles led by Edward III and his son, while the latter Peter was supported by France. The conflict also brought in the involvement of the kingdoms of Navarre and Portugal. The war resulted in Aragon gaining the upper hand, but it also devastated its economy that was already reeling from the effects of the Black Death.",War of the Two Peters,1356-01-01T00:00:00Z,http://www.wikidata.org/entity/Q2664602,,,"['Crown of Aragon', ' Crown of Castile', ' Pedro I of Castile', ' Peter IV of Aragon']",https://en.wikipedia.org/wiki/War_of_the_Two_Peters
http://commons.wikimedia.org/wiki/Special:FilePath/UltimosFilipinas.jpg,"The Philippine Revolution was a conflict waged by the Filipino revolutionaries against the Spanish colonial authorities in an attempt to win the archipelago's independence.
The Philippine Revolution began on August 24, 1896, when the Spanish authorities discovered the Katipunan, an anticolonial secret organization. The Katipunan, led by Andrés Bonifacio, began to influence much of the Philippines, taking full advantage of Spanish failures against Cuban nationalists in 1895 and declaring Spain a weakened empire. During a mass gathering in Caloocan, the leaders of the Katipunan organized into a revolutionary government, named the newly established government ""Haring Bayang Katagalugan"", and openly declared a nationwide armed revolution. Bonifacio called for an attack on the capital city of Manila. This attack failed; however, the surrounding provinces began to revolt. In particular, rebels in Cavite led by Mariano Álvarez and Baldomero Aguinaldo (who were leaders from two different factions of the Katipunan) won early major victories. A power struggle among the revolutionaries led to a schism among Katipunan leadership followed by Bonifacio's execution in 1897, with command having shifted to Emilio Aguinaldo, who led the newly formed revolutionary government. That year, revolutionaries and the Spanish signed the Pact of Biak-na-Bato, which temporarily reduced hostilities. Filipino revolutionary officers exiled themselves to Hong Kong. However, the hostilities never completely ceased.On April 21, 1898, after the sinking of the USS Maine in Havana Harbor and prior to its declaration of war on April 25, the United States launched a naval blockade of the Spanish island of Cuba, off its southern coast of the peninsula of Florida. This was the first military action of the Spanish–American War of 1898. On May 1, the U.S. Navy's Asiatic Squadron, under Commodore George Dewey, decisively defeated the Spanish Navy in the Battle of Manila Bay, effectively seizing control of the area surrounding Manila. On May 19, Aguinaldo, unofficially allied with the United States, returned to the Philippines and resumed attacks against the Spaniards. By June, the rebels had gained control of nearly all of the Philippines' countryside, while the cities remained under Spanish control. On June 12, Aguinaldo issued the Philippine Declaration of Independence. Although this signified the end date of the revolution, neither Spain nor the United States recognized Philippine independence.The Spanish rule of the Philippines officially ended with the Treaty of Paris of 1898, which also ended the Spanish–American War. In the treaty, Spain ceded control of the Philippines and other territories to the United States. There was an uneasy peace around Manila, with the U.S. forces controlling the city and the weaker Philippines forces surrounding them.
On February 4, 1899, in the Battle of Manila, fighting broke out between the Filipino and American forces, beginning the Philippine–American War. Aguinaldo immediately ordered ""that peace and friendly relations with the Americans be broken and that the latter be treated as enemies"". In June 1899, the nascent First Philippine Republic formally declared war against the United States, in which the Americans prevailed.
As a result of the war, the Philippines became commonwealth under the U.S. and would not become an internationally recognized independent state until 1946.",Philippine Revolution,1896-01-01T00:00:00Z,http://www.wikidata.org/entity/Q422082,,,,https://en.wikipedia.org/wiki/Philippine_Revolution
http://commons.wikimedia.org/wiki/Special:FilePath/Osceola.jpg,"The Second Seminole War, also known as the Florida War, was a conflict from 1835 to 1842 in Florida between the United States and groups of people collectively known as Seminoles, consisting of Native Americans and Black Indians. It was part of a series of conflicts called the Seminole Wars. The Second Seminole War, often referred to as the Seminole War, is regarded as ""the longest and most costly of the Indian conflicts of the United States"". After the Treaty of Payne's Landing in 1832 that called for the Seminole's removal from Florida, tensions rose until fierce hostilities occurred in the Dade battle in 1835. This conflict started the war. The Seminoles and the U.S. forces engaged in mostly small engagements for more than six years. By 1842, only a few hundred native peoples remained in Florida. Although no peace treaty was ever signed, the war was declared over on August 14, 1842.",Second Seminole War,1835-12-23T00:00:00Z,http://www.wikidata.org/entity/Q2976715,,,"['Seminole', ' United States of America']",https://en.wikipedia.org/wiki/Second_Seminole_War
http://commons.wikimedia.org/wiki/Special:FilePath/Sueleymanname%20nahcevan.jpg,,Ottoman-Safavid War,1532-01-01T00:00:00Z,http://www.wikidata.org/entity/Q700841,,,"['Safavid dynasty', ' Ottoman Empire']",https://en.wikipedia.org/wiki/Ottoman–Safavid_War_(1532–1555)
http://commons.wikimedia.org/wiki/Special:FilePath/Map%20of%20plebiscite%20area.jpg,,Polish–Czechoslovak War,1919-01-30T00:00:00Z,http://www.wikidata.org/entity/Q1933729,,,"['First Czechoslovak Republic', ' Second Polish Republic']",https://en.wikipedia.org/wiki/Polish–Czechoslovak_War
http://commons.wikimedia.org/wiki/Special:FilePath/Burmese-Siamese%20war%20%281765-1767%29%20map%20-%20EN%20-%20001.jpg,,Burmese–Siamese War (1765–67),1767-04-07T00:00:00Z,http://www.wikidata.org/entity/Q31307,,,"['Ayutthaya Kingdom', ' Konbaung dynasty']",https://en.wikipedia.org/wiki/Burmese–Siamese_War_(1765–1767)
http://commons.wikimedia.org/wiki/Special:FilePath/Carga%20de%20O%27Higgins.jpg,"The Chilean War of Independence (Spanish: Guerra de la Independencia de Chile, 'War of Independence of Chile') was a military and political event that allowed the emancipation of Chile from the Spanish Monarchy, ending the colonial period and initiating the formation of an independent republic.
It developed in the context of the Spanish American Wars of independence, a military and political process that began after the formation of self-government juntas in the Spanish-American colonies, in response to the capture of King Ferdinand VII of Spain by Napoleonic forces in 1808. The First Government Junta of Chile was formed for that purpose. But then, it began to gradually radicalize, which caused a military struggle between Patriots, who were looking for a definitive separation from the Spanish Crown; and Royalists, who sought to maintain unity with her. 
Traditionally, Chilean historiography covers this period between the establishment of the First Government Junta of Chile (September 18, 1810) and the resignation of Bernardo O'Higgins as Supreme Director of Chile (January 28, 1823). It is also subdivided into three stages: the Patria Vieja (1810–1814), Reconquista (1814–1817) and the Patria Nueva (1817–1823). Although the war began in 1812, the year in which the first hostile actions took place, and lasted until 1826, when the last royalist forces were defeated in Chiloé Archipelago. 
A declaration of independence was officially issued by Chile on February 12, 1818 and formally recognized by Spain in 1844, when full diplomatic relations were established.",Chilean War of Independence,1810-01-01T00:00:00Z,http://www.wikidata.org/entity/Q1072889,,,,https://en.wikipedia.org/wiki/Chilean_War_of_Independence
http://commons.wikimedia.org/wiki/Special:FilePath/Battle%20of%20Pavia%2C%20oil%20on%20panel.jpg,"The Italian War of 1521–1526, sometimes known as the Four Years' War, (French: Sixième guerre d'Italie) was a part of the Italian Wars.  The war pitted Francis I of France and the Republic of Venice against the Holy Roman Emperor Charles V, Henry VIII of England, and the Papal States.  It arose from animosity over the election of Charles as Emperor in 1519–1520 and from Pope Leo X's need to ally with Charles against Martin Luther.
The war broke out across Western Europe late in 1521, when a French–Navarrese expedition attempted to reconquer Navarre while a French army invaded the Low Countries.  A Spanish army drove the Navarrese forces back into the Pyrenees, and other Imperial forces attacked northern France, where they were stopped in turn.
In 1521 Charles V and Henry VIII signed the Treaty of Bruges in secret against France, and hostilities resumed on the Italian Peninsula. At the Battle of Bicocca on 27 April 1522, Imperial and Papal forces defeated the French, driving them from Lombardy. Following the battle, fighting again spilled onto French soil, while Venice made a separate peace.  The English invaded France in 1523, while the French military leader Charles de Bourbon, alienated by Francis's attempts to seize his inheritance, betrayed Francis and allied himself with the Emperor.  The failure of a French attempt to regain Lombardy in 1524 provided Bourbon with an opportunity to invade Provence at the head of a Spanish army.
Francis led a second attack on Milan in 1525. His disastrous defeat at the Battle of Pavia, where he was captured by the Imperial captain Charles de Lannoy and many of his chief nobles were killed, led to the end of the war. Francis was imprisoned in the Lombard city of Pizzighettone and then in Madrid. Diplomatic maneuvers to obtain his release included a French mission sent by his mother, Louise of Savoy, to the court of Suleiman the Magnificent that resulted in an Ottoman ultimatum to Charles. This unprecedented alignment between Christian and Muslim monarchs caused a scandal in the Christian world, and laid the foundation for the Franco-Ottoman alliance. Suleiman invaded Hungary in the summer of 1526, defeating Charles' allies at the Battle of Mohács. Despite these efforts, Francis signed the Treaty of Madrid, surrendering his claims to Italy, Artois, Flanders, and Burgundy. A few weeks after his release, he repudiated the terms of the treaty, starting the War of the League of Cognac.  The Italian Wars continued for another three decades, ending with France having failed to regain any substantial territories in Italy.",Italian War of 1521–1526,1521-01-01T00:00:00Z,http://www.wikidata.org/entity/Q698281,,,"['Kingdom of France', ' Republic of Venice', ' Spanish Empire', ' Holy Roman Empire', ' Papal States', ' Kingdom of England']",https://en.wikipedia.org/wiki/Italian_War_of_1521–1526
http://commons.wikimedia.org/wiki/Special:FilePath/Hogan%27s%20Flying%20Column.gif,"The Irish War of Independence (Irish: Cogadh na Saoirse) or Anglo-Irish War was a guerrilla war fought in Ireland from 1919 to 1921 between the Irish Republican Army (IRA, the army of the Irish Republic) and British forces: the British Army, along with the quasi-military Royal Irish Constabulary (RIC) and its paramilitary forces the Auxiliaries and Ulster Special Constabulary (USC). It was part of the Irish revolutionary period.
In April 1916, Irish republicans launched the Easter Rising against British rule and proclaimed an Irish Republic. Although it was defeated after a week of fighting, the Rising and the British response led to greater popular support for Irish independence. In the December 1918 election, republican party Sinn Féin won a landslide victory in Ireland. On 21 January 1919 they formed a breakaway government (Dáil Éireann) and declared Irish independence. That day, two RIC officers were killed in the Soloheadbeg ambush by IRA volunteers acting on their own initiative. The conflict developed gradually. For most of 1919, IRA activity involved capturing weaponry and freeing republican prisoners, while the Dáil set about building a state. In September, the British government outlawed the Dáil and Sinn Féin, and the conflict intensified. The IRA began ambushing RIC and British Army patrols, attacking their barracks and forcing isolated barracks to be abandoned. The British government bolstered the RIC with recruits from Britain—the Black and Tans and Auxiliaries—who became notorious for ill-discipline and reprisal attacks on civilians, some of which were authorised by the British government. Thus the conflict is sometimes called the ""Black and Tan War"". The conflict also involved civil disobedience, notably the refusal of Irish railwaymen to transport British forces or military supplies.
In mid-1920, republicans won control of most county councils, and British authority collapsed in most of the south and west, forcing the British government to introduce emergency powers. About 300 people had been killed by late 1920, but the conflict escalated in November. On Bloody Sunday in Dublin, 21 November 1920, fourteen British intelligence operatives were assassinated; then the RIC fired on the crowd at a Gaelic football match, killing fourteen civilians and wounding sixty-five. A week later, the IRA killed seventeen Auxiliaries in the Kilmichael Ambush in County Cork. In December, the British authorities declared martial law in much of southern Ireland, and the centre of Cork city was burnt out by British forces in reprisal for an ambush. Violence continued to escalate over the next seven months, when 1,000 people were killed and 4,500 republicans were interned. Much of the fighting took place in Munster (particularly County Cork), Dublin and Belfast, which together saw over 75 percent of the conflict deaths.The conflict in north-east Ulster had a sectarian aspect (see The Troubles (1920–1922)). While the Catholic minority there mostly backed Irish independence, the Protestant majority were mostly unionist/loyalist. A mainly Protestant special constabulary was formed, and loyalist paramilitaries were active. They attacked Catholics in reprisal for IRA actions, and in Belfast a sectarian conflict raged in which almost 500 were killed, most of them Catholics. In May 1921, Ireland was partitioned under British law by the Government of Ireland Act, which created Northern Ireland.
A ceasefire began on 11 July 1921. The post-ceasefire talks led to the signing of the Anglo-Irish Treaty on 6 December 1921. This ended British rule in most of Ireland and, after a ten-month transitional period overseen by a provisional government, the Irish Free State was created as a self-governing Dominion on 6 December 1922. Northern Ireland remained within the United Kingdom. After the ceasefire, violence in Belfast and fighting in border areas of Northern Ireland continued, and the IRA launched a failed Northern offensive in May 1922. In June 1922, disagreement among republicans over the Anglo-Irish Treaty led to the eleven-month Irish Civil War. The Irish Free State awarded 62,868 medals for service during the War of Independence, of which 15,224 were issued to IRA fighters of the flying columns.",Irish War of Independence,1919-01-21T00:00:00Z,http://www.wikidata.org/entity/Q208297,,,,https://en.wikipedia.org/wiki/Irish_War_of_Independence
http://commons.wikimedia.org/wiki/Special:FilePath/Mar%20Saba%20%28Photo%20by%20Jean%20%26%20Nathalie%2C%202011%29.jpg,"The War of Saint Sabas (1256–1270) was a conflict between the rival Italian maritime republics of Genoa (aided by Philip of Montfort, Lord of Tyre, John of Arsuf, and the Knights Hospitaller) and Venice (aided by the Count of Jaffa and Ascalon,  John of Ibelin, and the Knights Templar), over control of Acre, in the Kingdom of Jerusalem.",War of Saint Sabas,1256-01-01T00:00:00Z,http://www.wikidata.org/entity/Q1305130,,,"['Republic of Venice', ' Republic of Genoa']",https://en.wikipedia.org/wiki/War_of_Saint_Sabas
http://commons.wikimedia.org/wiki/Special:FilePath/1.%20ZM%20Stoomschip%20Celebes%20in%20gevecht%20met%20een%20Kota%20Mara%206%20aug%201859%20Poeloe%20Kananat%20opgenomen.jpg,"The Banjarmasin War (in old spelling Bandjermasin War, Dutch: Bandjermasinse Oorlog, or formally Expeditie naar de Zuider- en Oosterafdeling van Borneo) (1859–1863) was a war of succession in the Sultanate of Banjarmasin, as well as a colonial war for the restoration of Dutch authority in the eastern and southern section of Borneo.",Banjarmasin War,1859-01-01T00:00:00Z,http://www.wikidata.org/entity/Q368594,,,,https://en.wikipedia.org/wiki/Banjarmasin_War
http://commons.wikimedia.org/wiki/Special:FilePath/T-62%20et%20T-55%20d%C3%A9truits%20durant%20la%20guerre%20civile%20%C3%A9thiopienne%20en%201991.jpg,"The Ethiopian Civil War was a civil war in Ethiopia and present-day Eritrea, fought between the Ethiopian military junta known as the Derg and Ethiopian-Eritrean anti-government rebels from 12 September 1974 to 28 May 1991.
The Derg overthrew the Ethiopian Empire and Emperor Haile Selassie in a coup d'état on 12 September 1974, establishing Ethiopia as a Marxist-Leninist state under a military junta and provisional government. Various opposition groups of ideological affiliations ranging from Communist to anti-Communist, often drawn from ethnic background, began armed resistance to the Soviet-backed Derg, in addition to the Eritrean separatists already fighting in the Eritrean War of Independence. The Derg used military campaigns and the Qey Shibir (Ethiopian Red Terror) to repress the rebels. By the mid-1980s, various issues such as the 1983–1985 famine, economic decline, and other after-effects of Derg policies ravaged Ethiopia, increasing popular support for the rebels. The Derg dissolved itself in 1987, establishing the People's Democratic Republic of Ethiopia (PDRE) under the Workers' Party of Ethiopia (WPE) in an attempt to maintain its rule. The Soviet Union began ending its support for the PDRE in the late-1980s and the government was overwhelmed by the increasingly victorious rebel groups. In May 1991, the PDRE was defeated in Eritrea and President Mengistu Haile Mariam fled the country. The Ethiopian Civil War ended on 28 May 1991 when the Ethiopian People's Revolutionary Democratic Front (EPRDF), a coalition of left-wing ethnic rebel groups, entered the capital Addis Ababa. The PDRE was dissolved and replaced with the Tigray People's Liberation Front-led Transitional Government of Ethiopia.The Ethiopian Civil War left at least 1.4 million people dead, with 1 million of the deaths being related to famine and the remainder from combat and other violence.",Ethiopian Civil War,1974-09-12T00:00:00Z,http://www.wikidata.org/entity/Q257724,,,,https://en.wikipedia.org/wiki/Ethiopian_Civil_War
http://commons.wikimedia.org/wiki/Special:FilePath/Comancheria.jpg,"The Texas–Indian wars were a series of conflicts between settlers in Texas and the Southern Plains Indians during the 19th-century. Conflict between the Plains Indians and the Spanish began before other European and Anglo-American settlers were encouraged—first by Spain and then by the newly Independent Mexican government—to colonize Texas in order to provide a protective-settlement buffer in Texas between the Plains Indians and the rest of Mexico. As a consequence, conflict between Anglo-American settlers and Plains Indians occurred during the Texas colonial period as part of Mexico. The conflicts continued after Texas secured its independence from Mexico in 1836 and did not end until 30 years after Texas became a state of the United States, when in 1875 the last free band of Plains Indians, the Comanches led by Quahadi warrior Quanah Parker, surrendered and moved to the Fort Sill reservation in Oklahoma.The more than half-century struggle between the Plains tribes and the Texans became particularly intense after the Spanish, and then Mexicans, left power in Texas. The Republic of Texas, which was largely settled by Anglo-Americans, was a threat to the indigenous people of the region. The wars between the Plains Indians and Texas settlers and later the United States Army was characterized by deep animosity, slaughter on both sides, and, in the end, near-total conquest of the Indian territories.Although several native tribes occupied territory in the area, the preeminent nation was the Comanche, known as the ""Lords of the Plains"". Their territory, the Comancheria, was the most powerful entity and persistently hostile to the Spanish, the Mexicans, the Texans, and finally the Americans. The Comanche were known as fierce warriors, with a reputation for looting, burning, murdering, and kidnapping as far south as Mexico City. When Sul Ross rescued Cynthia Ann Parker at Pease River, he observed that this event would be felt in every family in Texas, as every one had lost someone in the Indian Wars. During the American Civil War, when the U.S. Army was unavailable to protect the frontier, the Comanche and Kiowa pushed white settlements back more than 100 miles along the Texas frontier.",Texas–Indian wars,1820-01-01T00:00:00Z,http://www.wikidata.org/entity/Q474891,,,"['Mexico', ' Comanche', ' United States of America', ' Spain', ' Republic of Texas']",https://en.wikipedia.org/wiki/Texas–Indian_wars
http://commons.wikimedia.org/wiki/Special:FilePath/Syrian%2C%20Iraqi%2C%20and%20Lebanese%20insurgencies.png,"The spillover of the Syrian Civil War is the impact of the Syrian Civil War in the Arab world and beyond. Since the first protests during the Arab Spring, the increasingly violent Syrian Civil War has been both a proxy war for the major Middle Eastern powers, Turkey and Iran, and a potential launching point for a wider regional war. Fears of the latter were realized when the Islamic State of Iraq and the Levant (ISIL), a Salafi Jihadist militant group and alleged former al-Qaeda affiliate, established itself in Syria in 2013, and later combined with the War in Iraq (2013–2017) into a single conflict the following year.",spillover of the Syrian Civil War,2011-06-17T00:00:00Z,http://www.wikidata.org/entity/Q17272643,,,,https://en.wikipedia.org/wiki/Spillover_of_the_Syrian_civil_war
http://commons.wikimedia.org/wiki/Special:FilePath/Didier%20Etumba%20et%20un%20officiel%20Rwandais.jpg,"The 2009 Eastern Congo offensive was a joint Congo-Rwanda military offensive against the Hutu Democratic Forces for the Liberation of Rwanda (FDLR) rebel group descended from those groups that carried out the 1994 Rwanda genocide. Two operations were carried out: 'Kimia II' and 'Umoja Wetu.' 'Kimia' can be translated as 'calm.' ""Umoja Wetu"" is Swahili for ""Our Unity"".",2009 Eastern Congo offensive,2009-02-27T00:00:00Z,http://www.wikidata.org/entity/Q3196886,,,,https://en.wikipedia.org/wiki/2009_Eastern_Congo_offensive
http://commons.wikimedia.org/wiki/Special:FilePath/Karim%20Khan%20Zand%20with%20the%20Ottoman%20Ambassador%20Vehbi%20Effendi.png,,Ottoman–Persian War,1775-01-01T00:00:00Z,http://www.wikidata.org/entity/Q6077256,,,,https://en.wikipedia.org/wiki/Ottoman–Persian_War_(1775–1776)
http://commons.wikimedia.org/wiki/Special:FilePath/PBW%20March%201919.png,"The Polish–Ukrainian War, from November 1918 to July 1919, was a conflict between the Second Polish Republic and Ukrainian forces (both the West Ukrainian People's Republic and Ukrainian People's Republic). The conflict had its roots in ethnic, cultural and political differences between the Polish and Ukrainian populations living in the region, as Poland and both Ukrainian republics were successor states to the dissolved Russian and Austrian empires. The war started in Eastern Galicia after the dissolution of the Austro-Hungarian Empire and spilled over into the Kholm (Chełm) and Volhynia (Wołyń) regions formerly belonging to the Russian Empire. Poland re-occupied the disputed territory on 18 July 1919.

",Polish–Ukrainian War,1918-11-01T00:00:00Z,http://www.wikidata.org/entity/Q842774,,,"['Second Polish Republic', "" West Ukrainian People's Republic""]",https://en.wikipedia.org/wiki/Polish–Ukrainian_War
http://commons.wikimedia.org/wiki/Special:FilePath/Benjamin%20Duterrau%20-%20Timmy%2C%20a%20Tasmanian%20Aboriginal%2C%20throwing%20a%20spear%20-%20Google%20Art%20Project.jpg,"The Black War was a period of violent conflict between British colonists and Aboriginal Tasmanians in Tasmania from the mid-1820s to 1832. The conflict, fought largely as a guerrilla war by both sides, claimed the lives of 600 to 900 Aboriginal people and more than 200 British colonists. The near-destruction of the Aboriginal Tasmanians and the frequent incidence of mass killings have sparked debate among historians over whether the Black War should be defined as an act of genocide.",Black War,1832-01-01T00:00:00Z,http://www.wikidata.org/entity/Q880629,,,['British Empire'],https://en.wikipedia.org/wiki/Black_War
