image,summary_wikipedia,eventLabel,date,event,label,article,participants,article_en
http://commons.wikimedia.org/wiki/Special:FilePath/Locator%20Duchy%20of%20Guelders%20and%20County%20of%20Zutphen%20%281350%29.svg,"The First War of the Guelderian Succession was a battle for the throne of the Duchy of Guelders that raged between 1371 and 1379.
The war originated when Duke Reginald III died without issue in 1371. His brother, Edward, who had been killed in the Battle of Baesweiler earlier that same year, also left no offspring. The claimants to the ducal throne were their half-sisters: Matilda, who was married to John II, Count of Blois, and Maria, wife of William II of Jülich and mother to William I of Guelders and Jülich, on whose behalf she claimed the throne of Guelders.
14th-century Guelders was divided in two factions:

The Heeckerens supported Matilda, and were led by Frederik van Heeckeren van der Eze (1320-1386).
The Bronckhorsters supported William, and were led by Gijsbert V van Bronckhorst (1328-1356).The war lasted eight years, with Maria and her supporters emerging victorious, and Maria's son William becoming duke.",First War of the Guelderian Succession,1371-01-01T00:00:00Z,http://www.wikidata.org/entity/Q1362154,,,,https://en.wikipedia.org/wiki/First_War_of_the_Guelderian_Succession
http://commons.wikimedia.org/wiki/Special:FilePath/Embarcament%20dels%20voluntaris%20catalans%20al%20port%20de%20Barcelona.jpg,"The Ten Years' War (Spanish: Guerra de los Diez Años; 1868–1878), also known as the Great War (Guerra Grande) and the War of '68, was part of Cuba's fight for independence from Spain. The uprising was led by Cuban-born planters and other wealthy natives. On 10 October 1868, sugar mill owner Carlos Manuel de Céspedes and his followers proclaimed independence, beginning the conflict. This was the first of three liberation wars that Cuba fought against Spain, the other two being the Little War (1879–1880) and the Cuban War of Independence (1895–1898). The final three months of the last conflict escalated with United States involvement, leading to the Spanish–American War.",Ten Years' War,1868-10-10T00:00:00Z,http://www.wikidata.org/entity/Q184637,,,"['Spain under the Restoration', ' Ejército Libertador Cubano']",https://en.wikipedia.org/wiki/Ten_Years'_War
http://commons.wikimedia.org/wiki/Special:FilePath/Elephant%20Pass%20armored%20bulldozer.JPG,"Eelam War II is the name given to the second phase of armed conflict between Sri Lankan military and the separatist Liberation Tigers of Tamil Eelam.  The war started after the failure of peace talks between the Premadasa government and the LTTE. This phase of the war was initiated by the LTTE who massacred almost 600 Sinhalese and Muslim police personnel after they were ordered by the Premadasa government to surrender to the LTTE.  The truce was broken on June 10, 1990 when the LTTE in October expelled all the 28,000 Muslims residing in Jaffna.",Eelam War II,1990-01-01T00:00:00Z,http://www.wikidata.org/entity/Q11050383,,,"['Sri Lanka', ' Liberation Tigers of Tamil Eelam']",https://en.wikipedia.org/wiki/Eelam_War_II
http://commons.wikimedia.org/wiki/Special:FilePath/Operation25yu.jpg,"The invasion of Yugoslavia, also known as the April War or Operation 25, was a German-led attack on the Kingdom of Yugoslavia by the Axis powers which began on 6 April 1941 during World War II. The order for the invasion was put forward in ""Führer Directive No. 25"", which Adolf Hitler issued on 27 March 1941, following a Yugoslav coup d'état that overthrew the pro-Axis government.The invasion commenced with an overwhelming air attack on Belgrade and facilities of the Royal Yugoslav Air Force (VVKJ) by the Luftwaffe (German Air Force) and attacks by German land forces from southwestern Bulgaria. These attacks were followed by German thrusts from Romania, Hungary and the Ostmark (modern-day Austria, then part of Germany). Italian forces were limited to air and artillery attacks until 11 April, when the Italian army attacked towards Ljubljana (in modern-day Slovenia) and through Istria and Lika and down the Dalmatian coast. On the same day, Hungarian forces entered Yugoslav Bačka and Baranya, but like the Italians they faced practically no resistance. A Yugoslav attack into the northern parts of the Italian protectorate of Albania met with initial success, but was inconsequential due to the collapse of the rest of the Yugoslav forces.
Scholars have proposed several theories for the Royal Yugoslav Army's sudden collapse, including poor training and equipment, generals eager to secure a quick cessation of hostilities, and Croatian, Slovenian, and ethnic German fifth column activities. The latter has been questioned by scholars who have suggested that the fifth column had little effect on the ultimate outcome. The invasion ended when an armistice was signed on 17 April 1941, based on the unconditional surrender of the Yugoslav army, which came into effect at noon on 18 April. The Kingdom of Yugoslavia was then occupied and partitioned by the Axis powers. Most of Serbia and the Banat became a German zone of occupation while other areas of Yugoslavia were annexed by neighboring Axis countries, Germany, Hungary, Italy, Albania and Bulgaria. Croatia became the Independent State of Croatia (Serbo-Croatian Latin: Nezavisna Država Hrvatska, or NDH), an Axis puppet state created during the invasion comprising the Srem, Bosnia and Herzegovina as well as the Croatian lands. Along with Italy's stalled invasion of Greece on 28 October 1940, and the German-led invasion of Greece (Operation Marita) and invasion of Crete (Operation Merkur), the invasion of Yugoslavia was part of the German Balkan Campaign (German: Balkanfeldzug).",invasion of Yugoslavia,1941-04-18T00:00:00Z,http://www.wikidata.org/entity/Q697842,,,,https://en.wikipedia.org/wiki/Invasion_of_Yugoslavia
http://commons.wikimedia.org/wiki/Special:FilePath/Cenepa%20river%20basin.jpg,"The Cenepa War (26 January – 28 February 1995), also known as the Alto Cenepa War, was a brief and localized military conflict between Ecuador and Peru, fought over control of an area in Peruvian territory (i.e. in the eastern side of the Cordillera del Cóndor, Province of Condorcanqui, Región Amazonas, Republic of Perú) near the border between the two countries. The two nations had signed a border treaty following the Ecuadorian–Peruvian War of 1941, but Ecuador later disagreed with the treaty as it applied to the Cenepa and Paquisha areas, and in 1960 it declared the treaty null and void. Most of the fighting took place around the headwaters of the Cenepa River.
Mediation efforts of Argentina, Brazil, Chile and the United States paved the way for the opening of diplomatic conversations that ultimately led to the signing of a definitive peace agreement (the Brasilia Presidential Act) on 26 October 1998. The peace agreement saw some of the territory being leased to Ecuador for a time. It was followed by the formal demarcation of the border on 13 May 1999 and the end of the multinational MOMEP (Military Observer Mission for Ecuador and Peru) troop deployment on 17 June 1999, which effectively put an end to one of the longest territorial disputes in the Western Hemisphere.Official estimates give a death toll of 94. Demining is expected to be completed in 2024. As of 2023, it is the most recent military conflict in the Americas between countries contesting sovereignty over territory.",Cenepa War,1995-02-28T00:00:00Z,http://www.wikidata.org/entity/Q2337340,,,"['Ecuador', ' Peru']",https://en.wikipedia.org/wiki/Cenepa_War
http://commons.wikimedia.org/wiki/Special:FilePath/Magdeburg%201631.jpg,"The Thirty Years' War was one of the longest and most destructive conflicts in European history, lasting from 1618 to 1648. Fought primarily in Central Europe, an estimated 4.5 to 8 million soldiers and civilians died as a result of battle, famine, and disease, while some areas of modern Germany experienced population declines of over 50%. Related conflicts include the Eighty Years' War, the War of the Mantuan Succession, the Franco-Spanish War, the Dutch-Portuguese War and the Portuguese Restoration War.
The war was traditionally viewed as a continuation of the religious conflict initiated by the 16th-century Reformation within the Holy Roman Empire. The 1555 Peace of Augsburg attempted to resolve this by dividing the Empire into Lutheran and Catholic states, but over the next 50 years the expansion of Protestantism beyond these boundaries destabilised the settlement. However, while modern commentators accept differences over religion and Imperial authority were important factors in causing the war, they argue its scope and extent were driven by the contest for European dominance between Habsburg-ruled Spain and Austria, and the French House of Bourbon.Its outbreak is generally traced to 1618, when Emperor Ferdinand II was deposed as king of Bohemia and replaced by the Protestant Frederick V of the Palatinate. Although Imperial forces quickly suppressed the Bohemian Revolt, his participation expanded the fighting into the Palatinate, whose strategic importance drew in the Dutch Republic and Spain, then engaged in the Eighty Years' War. Since rulers like Christian IV of Denmark and Gustavus Adolphus of Sweden also held territories within the Empire, this gave them and other foreign powers an excuse to intervene, turning an internal dynastic dispute into a broader European conflict.
The first phase from 1618 until 1635 was primarily a civil war between German members of the Holy Roman Empire, with support from external powers. After 1635, the Empire became one theatre in a wider struggle between France, supported by Sweden, and Emperor Ferdinand III, allied with Spain. This concluded with the 1648 Peace of Westphalia, whose provisions included greater autonomy within the Empire for states like Bavaria and Saxony, as well as acceptance of Dutch independence by Spain. The conflict shifted the balance of power in favour of France, and set the stage for the expansionist wars of Louis XIV which dominated Europe for the next sixty years.",Thirty Years' War,1618-05-23T00:00:00Z,http://www.wikidata.org/entity/Q2487,,,"['Kingdom of Scotland', ' Dutch Republic', ' Sweden', ' Duchy of Brunswick-Lüneburg', ' Holy Roman Empire', ' Kingdom of England', ' Kingdom of Hungary', ' Electoral Palatinate', ' Spanish Empire', ' Principality of Transylvania', ' Electorate of Saxony', ' Brandenburg-Prussia', ' Denmark–Norway', ' Lands of the Bohemian Crown', ' Kingdom of France', ' Kingdom of Scotland', ' Dutch Republic', ' Sweden', ' Duchy of Brunswick-Lüneburg', ' Holy Roman Empire', ' Kingdom of England', ' Kingdom of Hungary', ' Electoral Palatinate', ' Spanish Empire', ' Principality of Transylvania', ' Electorate of Saxony', ' Brandenburg-Prussia', ' Denmark–Norway', ' Lands of the Bohemian Crown', ' Kingdom of France']",https://en.wikipedia.org/wiki/Thirty_Years'_War
http://commons.wikimedia.org/wiki/Special:FilePath/Belagerung%20von%20Courtrai%201667.jpg,"In the 1667 to 1668 War of Devolution (French: Guerre de Dévolution, Dutch: Devolutieoorlog), France occupied large parts of the Spanish Netherlands and Franche-Comté, both then provinces of the Holy Roman Empire under the sovereignty of the King of Spain. The name derives from an obscure law known as the Jus Devolutionis, used by Louis XIV of France to claim that these territories had ""devolved"" to him by right of marriage to Maria Theresa of Spain.
In the fighting, the French encountered minimal resistance; however, Louis was more concerned with asserting his inheritance rights in the Spanish Empire, and consequently returned much of his gains in the May 1668 Treaty of Aix-la-Chapelle. The terms were agreed to by Emperor Leopold I in January 1668, reinforced by the Triple Alliance of England, Sweden and the Dutch Republic.
The conflict marked the end of the long-standing Franco-Dutch alliance, and was the first of the French wars of expansion that dominated Europe for the next 50 years.",War of Devolution,1667-05-24T00:00:00Z,http://www.wikidata.org/entity/Q25857,,,,https://en.wikipedia.org/wiki/War_of_Devolution
http://commons.wikimedia.org/wiki/Special:FilePath/Batalla%20del%20Pasteral.jpg,"The Second Carlist War, or the War of the Matiners (Catalan for ""early-risers,"" so-called from the harassing action that took place at the earliest hours of the morning), was a civil war in Spain. Some historians consider it a direct Catalan revolt against Madrid, fought primarily in Catalonia by the Carlists under General Ramón Cabrera against the forces of the government of Isabella II. The uprising began in September 1846 and continued until May 1849, spreading to Galicia.
Theoretically, the war was fought to facilitate the marriage of Isabella II with the Carlist pretender, Carlos de Borbón (or Carlos VI), which was supported by some doctrinaire elements from the moderate party and by the Carlists. The marriage never took place, as Isabella II was wed to Francisco de Borbón.
The conflict was rather minor in the Basque Country in the Basque context, a central focus of Carlist uprisings, it was non-existent, so ""Second Carlist War"" invariably refers to the Third Carlist War. It coincided with the democratic Revolutions of 1848, when Maria Christina revoked the constitution of Ramón de Narváez. Narváez himself led the counterattack against the revolt in Galicia while Fernando de Córdova, captain-general of Catalonia, put down the isolated rebel cells in that region by early 1849. In June of that year, amnesty was granted to the Carlists and those who had fled returned.
The war caused between 3,000 and 10,000 casualties.",Second Carlist War,1846-01-01T00:00:00Z,http://www.wikidata.org/entity/Q3025312,,,,https://en.wikipedia.org/wiki/Second_Carlist_War
http://commons.wikimedia.org/wiki/Special:FilePath/SiegeOfCuddalore1783.jpg,,Second Anglo-Mysore War,1780-01-01T00:00:00Z,http://www.wikidata.org/entity/Q233663,,,"['Great Britain', ' Dutch Republic', ' Kingdom of Mysore', ' Kingdom of France', ' Electorate of Brunswick-Lüneburg', ' East India Company']",https://en.wikipedia.org/wiki/Second_Anglo-Mysore_War
http://commons.wikimedia.org/wiki/Special:FilePath/Episodio%20delle%20cinque%20giornate%20%28Baldassare%20Verazzi%29.jpg,"The Five Days of Milan (Italian: Cinque giornate di Milano [ˈtʃiŋkwe dʒorˈnaːte di miˈlaːno]) was an insurrection and a major event in the Revolutionary Year of 1848 that started the First Italian War of Independence. On 18 March, a rebellion arose in the city of Milan which in five days of street fighting drove Marshal Radetzky and his Austrian soldiers from the city.",Five Days of Milan,1848-03-22T00:00:00Z,http://www.wikidata.org/entity/Q623164,,,"['Austrian Empire', ' Revolutions of 1848 in the Italian states']",https://en.wikipedia.org/wiki/Five_Days_of_Milan
http://commons.wikimedia.org/wiki/Special:FilePath/Tomba%20dels%20guerrillers%20caiguts%20a%20la%20invasi%C3%B3%20de%20la%20Vall%20d%27Aran%2C%20Vielha%201944.JPG,"The Invasion of Val d'Aran, known under the code name Operación Reconquista de España (""Operation Reconquest of Spain""), was a military operation launched in October 1944 by the Unión Nacional Española (antifrancoist) (es) (UNE). In October 1944, with the Spanish Civil War over and the Axis powers in World War II in retreat, guerrilla fighters loyal to the Republic tried to conquer Val d'Aran in Catalonia and establish a provisional Republican government presided over by Juan Negrín in order to later overthrow the dictatorship of Francisco Franco. The invasion, led by communist militant and French resistance member Vicente López Tovar, managed to overrun a number of Civil Guard outposts and take over several hamlets in the high areas of Arán, but was eventually repelled by the Francoist army, led by General José Moscardó, the defender of the Alcázar during the civil war. 
Moscardó established his headquarters at Vielha, the main administrative center of the valley, and, supported by heavy artillery, made impossible to the insurgents to advance through the Port de la Bonaigua and then into the lower lands. The guerrillas were also beaten off at Salardú, where they suffered a number of casualties.According to historian Geneviève Dreyfus-Armand, the UNE was a ""structure of a large alliance, (which) united not only Communists, but also Spaniards of different political alignments – Socialists, Republicans or Anarchists – who the dispersion of their organizations and the silence of their leaders pushed into joining the only fighting structure organised against Nazism"".",Invasion of Val d'Aran,1944-10-24T00:00:00Z,http://www.wikidata.org/entity/Q2748786,,,,https://en.wikipedia.org/wiki/Invasion_of_Val_d'Aran
http://commons.wikimedia.org/wiki/Special:FilePath/%D0%9F%D1%80%D0%B8%D0%B2%D0%B5%D0%B4%D0%B5%D0%BD%D0%B8%D0%B5%20%D0%BA%20%D0%BF%D1%80%D0%B8%D1%81%D1%8F%D0%B3%D0%B5%20%D0%BD%D0%B0%20%D0%B2%D0%B5%D1%80%D0%BD%D0%BE%D1%81%D1%82%D1%8C%20%D0%A0%D0%BE%D1%81%D1%81%D0%B8%D0%B8%20%D0%93%D0%B0%D1%81%D0%B8%D0%BC%20%D1%85%D0%B0%D0%BD%D0%B0%20%D0%B3%D1%80%D0%B0%D1%84%D0%BE%D0%BC%20%D0%97%D1%83%D0%B1%D0%BE%D0%B2%D0%B2%D1%8B%D0%BC.jpg,"The Persian expedition of Catherine the Great in 1796, like the Persian expedition of Peter the Great (1722-1723), was one of the Russo-Persian Wars of the 18th century which did not entail any lasting consequences for either belligerent.
The last decades of the 18th century were marked by continual strife between rival claimants to the Peacock Throne. Empress Catherine the Great of Russia (r. 1762–1796) took advantage of the disorder to consolidate her control over the weak polities of the Caucasus, which was, for swaths of it, an integral Persian domain. The kingdom of Georgia, a subject of the Persians for many centuries, became a Russian protectorate in 1783, when King Erekle II signed the Treaty of Georgievsk, whereby the Empress promised to defend him in the case of  Iranian attack. The shamkhals of Tarki followed this lead and accepted Russian protection three years later.
With the enthronement of Agha Mohammad Khan as Shah of Persia in 1794 the political climate changed. He put an end to the period of dynastic strife and proceeded to re-strengthen the Persian hold on the Caucasus by re-garrisoning the Iranian territories and cities in the area of modern-day Dagestan, Azerbaijan, and Armenia, as well as ravaging and recapturing Georgia and reducing its capital Tbilisi to a pile of ashes in 1795. Belatedly, the Empress Catherine determined to mount a punitive expedition against the Shah. The ultimate goal for the Russian government involved toppling the anti-Russian shah and replacing him with a half-brother of Agha Mohammad Khan, namely  Morteza Qoli Khan, who had defected to Russia, and was therefore pro-Russian.Although it was widely expected that a 50,000-strong Russian corps would be led by a seasoned general (Gudovich), the Empress followed the advice of her lover, Prince Platon Zubov, and entrusted the command to Zubov's youthful brother, Count Valerian Zubov. The Russian troops set out from Kizlyar in April 1796 and stormed the key fortress of Derbent on 10 May. The  Russian court poet Derzhavin glorified this event in a famous ode; he would later comment bitterly on Valerian Zubov's inglorious return from the expedition in another remarkable poem.
By mid-June Zubov's troops had overrun—without any resistance—most of the territory of modern-day Azerbaijan, including three principal cities—Baku, Shemakha and Ganja. By November they were stationed at the confluence of the Araks and Kura Rivers, poised to attack mainland Iran.
In that month the Empress of Russia died. Her successor, the Emperor Paul, who detested the Zubovs and had other plans for the army, ordered the troops to retreat back to Russia. This reversal aroused the frustration and enmity of the powerful Zubovs and other officers who took part in the campaign: many of them would join the conspiracy which arranged Paul's assassination five years later.",Persian Expedition of 1796,1796-11-01T00:00:00Z,http://www.wikidata.org/entity/Q525097,,,"['Qajar dynasty', ' Russian Empire']",https://en.wikipedia.org/wiki/Persian_expedition_of_1796
http://commons.wikimedia.org/wiki/Special:FilePath/%E5%A5%A5%E5%B7%9E%E9%AB%98%E9%A4%A8%E5%A4%A7%E5%90%88%E6%88%A6.jpg,"The Battle of Ōshū (奥州合戦, Ōshū-kassen) was a major battle between the Kamakura government and the Northern Fujiwara that took place in the Tōhoku region of Japan from September 1 to October 14, 1189. It resulted in the downfall of the Northern Fujiwara and the completion of Minamoto no Yoritomo's nationwide domination through the annexation of Mutsu and Dewa Province by the Kamakura shogunate. It was the last battle of the period of civil war known as the Jishō-Juei War that began in 1180, and its end marked the establishment of the first military government, the Kamakura shogunate.",Battle of Ōshū,1189-01-01T00:00:00Z,http://www.wikidata.org/entity/Q11445749,,,"['Minamoto no Yoritomo', ' Fujiwara no Yasuhira']",https://en.wikipedia.org/wiki/Battle_of_Ōshū
http://commons.wikimedia.org/wiki/Special:FilePath/Kargil%20war.jpg,"The Kargil War, also known as the Kargil conflict,[note (I)] was fought between India and Pakistan from May to July 1999 in the Kargil district of Jammu and Kashmir and elsewhere along the Line of Control (LoC). In India, the conflict is also referred to as Operation Vijay (Hindi: विजय, lit. 'Victory'), which was the codename of the Indian military operation in the region. The Indian Air Force acted jointly with the Indian Army to flush out the Pakistan Army and paramilitary troops from vacated Indian positions along the LoC, in what was designated as Operation Safed Sagar (ऑपरेशन सफेद सागर, lit. 'White Sea').
The conflict was triggered by the infiltration of Pakistani troops—disguised as Kashmiri militants—into strategic positions on the Indian side of the LoC, which serves as the de facto border between the two countries in the disputed region of Kashmir. During its initial stages, Pakistan blamed the fighting entirely on independent Kashmiri insurgents, but documents left behind by casualties and later statements by Pakistan's Prime Minister and Chief of Army Staff showed the involvement of Pakistani paramilitary forces, led by General Ashraf Rashid. The Indian Army, later supported by the Indian Air Force, recaptured a majority of the positions on the Indian side of the LoC; facing international diplomatic opposition, Pakistani forces withdrew from all remaining Indian positions along the LoC.
The Kargil War is the most recent example of high-altitude warfare in mountainous terrain, and as such, posed significant logistical problems for the combatting sides. It also marks one of only two instances of conventional warfare between nuclear-armed states (alongside the Sino-Soviet border conflict). India had conducted its first successful test in 1974; Pakistan, which had been developing its nuclear capability in secret since around the same time, conducted its first known tests in 1998, just two weeks after a second series of tests by India.",Kargil War,1999-01-01T00:00:00Z,http://www.wikidata.org/entity/Q404517,,,"['India', ' Pakistan']",https://en.wikipedia.org/wiki/Kargil_War
