image,summary_wikipedia,eventLabel,date,event,label,article,participants,article_en
http://commons.wikimedia.org/wiki/Special:FilePath/Turkish%20War%20of%20Independence%20-%20collage.jpg,"The Turkish War of Independence (19 May 1919 – 24 July 1923) was a series of military campaigns and a revolution waged by the Turkish National Movement, after parts of the Ottoman Empire were occupied and partitioned following its defeat in World War I. It resulted in the collapse of the Ottoman Empire, the abolition of the Turkish monarchy and of the Islamic Caliphate, and declaration of the Republic of Turkey in Anatolia and Eastern Thrace. The conflict was between the Turkish Nationalists against Allied and separatist forces over the application of Wilsonian principles, especially national self-determination, in post-war Anatolia and Eastern Thrace. In addition, it resulted in a transfer of vested sovereignty from the sultan-caliph to the nation, setting the stage of Republican Turkey's period of radical reform.
While World War I ended for the Ottoman Empire with the Armistice of Mudros, the Allied Powers continued occupying and seizing land per the Sykes–Picot Agreement, as well as to facilitate the prosecution of former members of the Committee of Union and Progress and those involved in the Armenian genocide. Ottoman military commanders therefore refused orders from both the Allies and the Ottoman government to surrender and disband their forces. This crisis reached a head when sultan Mehmed VI dispatched Mustafa Kemal Pasha (Atatürk), a well-respected and high-ranking general, to Anatolia to restore order; however, Mustafa Kemal became an enabler and eventually leader of Turkish Nationalist resistance against the Ottoman government, Allied powers, and separatists.
In an attempt to establish control over the power vacuum in Anatolia, the Allies agreed to launch a Greek peacekeeping force into Anatolia and occupy Smyrna (İzmir), inflaming sectarian tensions and beginning the Turkish War of Independence. A nationalist counter government led by Mustafa Kemal was established in Ankara when it became clear the Ottoman government was appeasing the Allied powers. The Allies soon pressured the Ottoman government in Constantinople to suspend the Constitution, shutter Parliament, and sign the Treaty of Sèvres, a treaty unfavorable to Turkish interests that the ""Ankara government"" declared illegal.
In the ensuing war, Turkish and Syrian forces defeated the French in the south, and remobilized army units went on to partition Armenia with the Bolsheviks, resulting in the Treaty of Kars (October 1921). The Western Front of the independence war is known as the Greco-Turkish War, in which Greek forces at first encountered unorganized resistance. However, İsmet Pasha (İnönü)'s organization of militia into a regular army paid off when Ankara forces fought the Greeks in the First and Second Battle of İnönü. The Greek army emerged victorious in the Battle of Kütahya-Eskişehir and decided to drive on the Nationalist capital of Ankara, stretching their supply lines. The Turks checked their advance in the Battle of Sakarya and eventually counter-attacked in the Great Offensive, which expelled Greek forces from Anatolia in the span of three weeks. The war effectively ended with the recapture of İzmir and the Chanak Crisis, prompting the signing of another armistice in Mudanya.
The Grand National Assembly in Ankara was recognized as the legitimate Turkish government, which signed the Treaty of Lausanne (July 1923), a treaty more favorable to Turkey than the Sèvres Treaty. The Allies evacuated Anatolia and Eastern Thrace, the Ottoman government was overthrown and the monarchy abolished, and the Grand National Assembly of Turkey (which remains Turkey's primary legislative body today) declared the Republic of Turkey on 29 October 1923. With the war, a population exchange between Greece and Turkey, the partitioning of the Ottoman Empire, and the abolition of the sultanate, the Ottoman era came to an end, and with Atatürk's reforms, the Turks created the modern, secular nation-state of Turkey. On 3 March 1924, the Ottoman caliphate was also abolished.
The ethnic demographics of the modern Turkish Republic were significantly impacted by the earlier Armenian genocide and the deportations of Greek-speaking, Orthodox Christian Rum people. The Turkish Nationalist Movement carried out massacres and deportations to eliminate native Christian populations—a continuation of the Armenian genocide and other ethnic cleansing operations during World War I. Following these campaigns of ethnic cleansing the historic Christian presence in Anatolia was destroyed, in large part, and the Muslim demographic had increased from 80% to 98%.

",Turkish War of Independence,1922-10-11T00:00:00Z,http://www.wikidata.org/entity/Q234738,,,"['Kuva-yi Milliye', ' Democratic Republic of Georgia', ' United States of America', ' Kingdom of Greece', ' Ottoman Empire', ' Turkish National Movement', ' United Kingdom of Great Britain and Ireland', ' Kingdom of Italy', ' Government of the Grand National Assembly', ' Kuva-yi Inzibatiye', ' French Third Republic', ' First Republic of Armenia', ' Kuva-yi Milliye', ' Democratic Republic of Georgia', ' United States of America', ' Kingdom of Greece', ' Ottoman Empire', ' Turkish National Movement', ' United Kingdom of Great Britain and Ireland', ' Kingdom of Italy', ' Government of the Grand National Assembly', ' Kuva-yi Inzibatiye', ' French Third Republic', ' First Republic of Armenia']",https://en.wikipedia.org/wiki/Turkish_War_of_Independence
http://commons.wikimedia.org/wiki/Special:FilePath/Mapa%20de%20la%20guerra%20civil%20Inca%2C%20Atahualpa%20al%20norte%20y%20Hu%C3%A1scar%20al%20sur.png,"The Inca Civil War, also known as the Inca Dynastic War, the Inca War of Succession, or, sometimes,  the War of the Two Brothers, was fought between half-brothers Huáscar and Atahualpa, sons of Huayna Capac, over succession to the throne of the Inca Empire.: 146–149  The war followed Huayna Capac's death.
It began in 1529, and lasted until 1532. Huáscar initiated the war; appointed as king and claiming the throne, he wanted to defeat Atahualpa's competition. Atahualpa was tactically superior to his brother in warcraft and to the mighty armies of Cuzco, which their father had stationed in the north part of the empire during the military campaign. Accounts from sources all vary in the exact details. Following Atahualpa's victory, Spanish forces led by Francisco Pizarro invaded this region. He ultimately captured and killed Atahualpa, after receiving a ransom that was purportedly to free him.",Inca Civil War,1532-04-01T00:00:00Z,http://www.wikidata.org/entity/Q1763918,,,,https://en.wikipedia.org/wiki/Inca_Civil_War
http://commons.wikimedia.org/wiki/Special:FilePath/Jean-Baptiste%20Huysmans%201.jpg,"The 1860 civil conflict in Mount Lebanon and Damascus (also called the 1860 Syrian Civil War) was a civil conflict in Mount Lebanon during Ottoman rule in 1860–1861 fought mainly between the local Druze and Christians. Following decisive Druze victories and massacres against the Christians, the conflict spilled over into other parts of Ottoman Syria, particularly Damascus, where thousands of Christian residents were killed by Muslim and Druze militiamen. The fighting precipitated a French-led international military intervention.",1860 civil conflict in Mount Lebanon and Damascus,1860-07-11T00:00:00Z,http://www.wikidata.org/entity/Q3772246,,,,https://en.wikipedia.org/wiki/1860_civil_conflict_in_Mount_Lebanon_and_Damascus
http://commons.wikimedia.org/wiki/Special:FilePath/Bitwa%20pod%20Parkanami.jpg,,Polish–Ottoman War of 1683–99,1683-01-01T00:00:00Z,http://www.wikidata.org/entity/Q1132994,,,,https://en.wikipedia.org/wiki/Polish–Ottoman_War_(1683–1699)
http://commons.wikimedia.org/wiki/Special:FilePath/Ireland%20medieval%20location%20map-es.svg,"The Anglo-Norman invasion of Ireland took place during the late 12th century, when Anglo-Normans gradually conquered and acquired large swathes of land from the Irish, over which the kings of England then claimed sovereignty, all allegedly sanctioned by the papal bull Laudabiliter. At the time, Gaelic Ireland was made up of several kingdoms, with a High King claiming lordship over most of the other kings. The Norman invasion was a watershed in Ireland's history, marking the beginning of more than 800 years of direct English and, later, British, conquest and colonialism in Ireland.
In May 1169, Anglo-Norman mercenaries landed in Ireland at the request of Diarmait mac Murchada (Dermot MacMurragh), the deposed King of Leinster, who sought their help in regaining his kingship. They achieved this within weeks and raided neighbouring kingdoms. This military intervention was sanctioned by King Henry II of England. In return, Diarmait had sworn loyalty to Henry and promised land to the Normans.
In 1170, there were further Norman landings, led by the Earl of Pembroke, Richard ""Strongbow"" de Clare. They seized the important Norse-Irish towns of Dublin and Waterford, and Strongbow married Diarmait's daughter Aoífe. Diarmait died in May 1171 and Strongbow claimed Leinster, which Diarmait had promised him. Led by High King Ruaidrí Ua Conchobair (Rory O'Conor), a coalition of most of the Irish kingdoms besieged Dublin, while Norman-held Waterford and Wexford were also attacked. However, the Normans managed to hold most of their territory.
In October 1171, King Henry landed with a large army to assert control over both the Anglo-Normans and the Irish. This intervention was supported by the Roman Catholic Church, who saw it as a means of ensuring Irish religious reform, and a source of taxes. At the time, Irish marriage laws conflicted with those of the broader Church, and the Gregorian Reform had not been fully implemented. Henry granted Strongbow Leinster as a fiefdom, declared the Norse-Irish towns to be crown land, and arranged the synod of Cashel to reform the Irish church.  Many Irish kings also submitted to him, likely in the hope that he would curb Norman expansion, but Henry granted the unconquered kingdom of Meath to Hugh de Lacy. After Henry's departure in 1172, fighting between the Normans and Irish continued.
The 1175 Treaty of Windsor acknowledged Henry as overlord of the conquered territory and Ruaidrí as overlord of the remainder of Ireland, with Ruaidrí also swearing fealty to Henry. The Treaty soon collapsed: Norman lords continued to invade Irish kingdoms and the Irish continued to attack the Normans. In 1177, Henry adopted a new policy. He declared his son John to be the ""Lord of Ireland"" (i.e. claiming the whole island) and authorised the Norman lords to conquer more land. The territory they held became the Lordship of Ireland, part of the Angevin Empire. The Normans' success has been attributed to military superiority and castle-building, the lack of a unified opposition from the Irish and the support of the church for Henry's intervention.",Norman invasion of Ireland,1169-01-01T00:00:00Z,http://www.wikidata.org/entity/Q901714,,,,https://en.wikipedia.org/wiki/Anglo-Norman_invasion_of_Ireland
http://commons.wikimedia.org/wiki/Special:FilePath/Kampene%20ved%20Skotterud.jpg,"The Swedish–Norwegian War, also known as the Campaign against Norway (Swedish: Fälttåget mot Norge), War with Sweden 1814 (Norwegian: Krigen med Sverige 1814), or the Norwegian War of Independence, was a war fought between Sweden and Norway in the summer of 1814. The war resulted in a compromise, with Norway being forced into the United Kingdoms of Sweden and Norway, a union with Sweden under the Swedish king Charles XIII, but with Norway having its own constitution and parliament. The war marked the last time Sweden participated in an armed conflict with another nation, and its conclusion signalled the beginning of the country's long period of military neutrality.",Swedish-Norwegian War,1814-01-01T00:00:00Z,http://www.wikidata.org/entity/Q1780850,,,"['Kingdom of Norway (1814)', ' Sweden']",https://en.wikipedia.org/wiki/Swedish–Norwegian_War
http://commons.wikimedia.org/wiki/Special:FilePath/Gazastrook%20Nederlandstalige%20kaart.svg,,Gaza War,2008-12-27T00:00:00Z,http://www.wikidata.org/entity/Q170682,,,"['Fatah', ' Gaza Strip', ' Islamic Jihad Movement in Palestine', ' Hamas', ' Israel', ' Popular Front for the Liberation of Palestine']",https://en.wikipedia.org/wiki/Gaza_War_(2008–2009)
http://commons.wikimedia.org/wiki/Special:FilePath/Lisa%20von%20L%C3%BCbeck%20-%20Photo%20by%20Doris%20Sch%C3%BCtz.jpg,,Anglo-Hanseatic War,1469-01-01T00:00:00Z,http://www.wikidata.org/entity/Q442268,,,"['Hanseatic League', ' Kingdom of England']",https://en.wikipedia.org/wiki/Anglo-Hanseatic_War
http://commons.wikimedia.org/wiki/Special:FilePath/S.%20V.%20Ivanov.%20At%20the%20guarding%20border%20of%20the%20Moscow%20state.%20%281907%29.jpg,,Crimean-Russian Wars,1570-01-01T00:00:00Z,http://www.wikidata.org/entity/Q923852,,,"['Grand Duchy of Moscow', ' Crimean Tatars']",https://en.wikipedia.org/wiki/Russo-Crimean_Wars
http://commons.wikimedia.org/wiki/Special:FilePath/%D0%A1%D0%B0%D1%83%D0%B4%D0%BE%D0%B2%D1%81%D0%BA%D0%BE-%D0%B9%D0%B5%D0%BC%D0%B5%D0%BD%D1%81%D0%BA%D0%B8%D0%B9%20%D0%BA%D0%BE%D0%BD%D1%84%D0%BB%D0%B8%D0%BA%D1%82.png,"The Houthi–Saudi Arabian conflict is an ongoing armed conflict between the Royal Saudi Armed Forces and Iran-backed Yemeni Houthi forces that has been taking place in the Arabian Peninsula, including the southern Saudi regions of Asir, Jizan, and Najran, and northern Yemeni governorates of Saada, Al Jawf, and Hajjah, since the onset of the Saudi Arabian-led intervention in Yemen in 2015.
Over the course of the conflict the Houthis have carried out attacks on military bases and outposts in Saudi Arabia.

",Houthi–Saudi Arabian conflict,2015-04-02T00:00:00Z,http://www.wikidata.org/entity/Q20896823,,,,https://en.wikipedia.org/wiki/Houthi–Saudi_Arabian_conflict
http://commons.wikimedia.org/wiki/Special:FilePath/S-b%20war%20painting%20by%20Antoni%20Piotrowski.jpg,,Serbo-Bulgarian War,1885-11-28T00:00:00Z,http://www.wikidata.org/entity/Q740791,,,,https://en.wikipedia.org/wiki/Serbo-Bulgarian_War
http://commons.wikimedia.org/wiki/Special:FilePath/The%20Battle%20of%20Culloden.jpg,"The Jacobite rising of 1745, also known as the Forty-five Rebellion or simply the '45 (Scottish Gaelic: Bliadhna Theàrlaich, [ˈpliən̪ˠə ˈhjaːrˠl̪ˠɪç], lit. 'The Year of Charles'), was an attempt by Charles Edward Stuart to regain the British throne for his father, James Francis Edward Stuart. It took place during the War of the Austrian Succession, when the bulk of the British Army was fighting in mainland Europe, and proved to be the last in a series of revolts that began in 1689, with major outbreaks in 1708, 1715 and 1719.
Charles launched the rebellion on 19 August 1745 at Glenfinnan in the Scottish Highlands, capturing Edinburgh and winning the Battle of Prestonpans in September. At a council in October, the Scots agreed to invade England after Charles assured them of substantial support from English Jacobites and a simultaneous French landing in Southern England. On that basis, the Jacobite army entered England in early November, but neither of these assurances proved accurate. On reaching Derby on 4 December, they halted to discuss future strategy.
Similar discussions had taken place at Carlisle, Preston and Manchester and many felt they had gone too far already. The invasion route had been selected to cross areas considered strongly Jacobite in sympathy, but the promised English support failed to materialise. With several government armies marching on their position, they were outnumbered and in danger of being cut off. The decision to retreat was supported by the vast majority, but caused an irretrievable split between Charles and his Scots supporters. Despite victory at Falkirk Muir in January 1746, defeat at Culloden in April ended the Rebellion. Charles escaped to France, but was unable to win support for another attempt, and died in Rome in 1788.",Jacobite rising of 1745,1746-04-20T00:00:00Z,http://www.wikidata.org/entity/Q1049945,Jacobite rising of 1745,https://en.wikipedia.org/wiki/Jacobite_rising_of_1745,,https://en.wikipedia.org/wiki/Jacobite_rising_of_1745
http://commons.wikimedia.org/wiki/Special:FilePath/Ethnoreligious%20Iraq.svg,"The Iraqi civil war was a civil war fought mainly between the Iraqi government along with American-led coalition forces and various sectarian armed groups, mainly Islamic State of Iraq and the Mahdi Army, from 2006 to 2008. In February 2006, the anti-American insurgency escalated into a sectarian civil war after the bombing of Al-Askari shrine, considered as a holy site in Twelver Shi'ism. US President George W. Bush and Iraqi officials accused Al-Qaeda in Iraq of orchestrating the bombing, although AQI publicly rejected any links to the attacks. The incident set off a wave of reprisals by Shia militants on Sunni civilians, followed by Sunni counterattacks on Shia civilians.The UN Secretary General stated in September 2006 that if patterns of discord and violence continued to prevail, the Iraqi state was in danger of breaking up. In a 10 January 2007 address, President George W. Bush stated that ""80% of Iraq's sectarian violence occurs within 30 miles (48 km) of the capital. This violence is splitting Baghdad into sectarian enclaves, and shakes the confidence of all Iraqis."". The conflict escalated over the next several months until by late 2007, the National Intelligence Estimate described the conflict as having elements of a civil war. In 2008, during the Sunni Awakening and the U.S. troop surge, violence declined dramatically. However, an insurgency by ISI continued to plague Iraq following the U.S. withdrawal from the country in late 2011. In June 2014 the Islamic State of Iraq and the Levant, the successor of Islamic State of Iraq, launched a major military offensive in Iraq and declared a self-proclaimed worldwide Islamic caliphate, leading to another full-scale war in Iraq from 2013 to 2017 in which Iraq declared full victory against the terrorist group.In October 2006, the Office of the United Nations High Commissioner for Refugees (UNHCR) and the Iraqi government estimated that more than 370,000 Iraqis had been displaced since the 2006 bombing of the al-Askari Mosque, bringing the total number of Iraqi refugees to more than 1.6 million. By 2008, the UNHCR raised the estimate of refugees to a total of about 4.7 million (~16% of the population). The number of refugees estimated abroad was 2 million (a number close to CIA projections) and the number of internally displaced people was 2.7 million. The Red Cross stated in 2008 that Iraq's humanitarian situation was among the most critical in the world, with millions of Iraqis forced to rely on insufficient and poor-quality water sources.According to the Failed States Index, produced by Foreign Policy magazine and the Fund for Peace, Iraq was one of the world's top 5 unstable states from 2005 to 2008.

",Iraqi Civil War (2006–2008),2006-02-22T00:00:00Z,http://www.wikidata.org/entity/Q17183365,,,,https://en.wikipedia.org/wiki/Iraqi_civil_war_(2006–2008)
http://commons.wikimedia.org/wiki/Special:FilePath/John%20of%20England%20vs%20Louis%20VIII%20of%20France.jpg,"The First Barons' War (1215–1217) was a civil war in the Kingdom of England in which a group of rebellious major landowners (commonly referred to as barons) led by Robert Fitzwalter waged war against King John of England. The conflict resulted from King John's disastrous wars against King Philip II of France, which led to the collapse of the Angevin Empire, and John's subsequent refusal to accept and abide by the Magna Carta, which John had sealed on 15 June 1215.
The rebellious barons, faced with an uncompromising king, turned to King Philip's son, Louis, who, in 1216, then sailed to England with an army despite his father's disapproval, as well as the pope's, who subsequently excommunicated him. Louis captured Winchester and soon controlled over half of the English kingdom. He was proclaimed ""King of England"" in London by the barons, although never actually crowned.
Louis's ambitions of ruling England faced a major setback in October 1216, when John's death led to the rebellious barons deserting him in favour of John's nine-year-old son, Henry III, and the war dragged on. Louis's army was finally beaten at the Battle of Lincoln on 20 May 1217. Also, after a fleet assembled by his wife, Blanche of Castile, attempted to bring him French reinforcements but was defeated off the coast of Sandwich on 24 August 1217, he was forced to make peace on English terms. He signed the Treaty of Lambeth and surrendered the few remaining castles that he held. The treaty had the effect of Louis agreeing he had never been the legitimate king of England. That formalised the end of the civil war and the departure of the French from England.",First Barons' War,1215-01-01T00:00:00Z,http://www.wikidata.org/entity/Q2086498,,,,https://en.wikipedia.org/wiki/First_Barons'_War
http://commons.wikimedia.org/wiki/Special:FilePath/Bachok%20Beach.jpg,"The Battle of Kota Bharu began just after midnight on 8 December 1941 (local time) before the attack on Pearl Harbor. It was the first major battle of the Pacific War, and was fought between ground forces of the British Indian Army and the Empire of Japan.
Kota Bharu, the capital of Kelantan State on Malaysia's northeast coast, was, in 1941, the Royal Air Force's (RAF) and Royal Australian Air Force's (RAAF) base of operations in Northern Malaya. There was an airstrip at Kota Bharu and two more at Gong Kedak and Machang. Japanese losses were significant because of sporadic Australian air attacks, Indian coastal defences, and artillery fire.",Battle of Kota Bharu,1941-12-08T00:00:00Z,http://www.wikidata.org/entity/Q1995675,,,,https://en.wikipedia.org/wiki/Battle_of_Kota_Bharu
http://commons.wikimedia.org/wiki/Special:FilePath/Sucre1.jpg,"The Bolivian war of independence (1809–1825) began with the establishment of government juntas in Sucre and La Paz, after the Chuquisaca Revolution and La Paz revolution. These Juntas were defeated shortly after, and the cities fell again under Spanish control. The May Revolution of 1810 ousted the viceroy in Buenos Aires, which established its own junta. Buenos Aires sent three large military expeditions to Upper Peru, headed by Juan José Castelli, Manuel Belgrano and José Rondeau, but the royalists ultimately prevailed over each one. However, the conflict grew into a guerrilla war, the War of the Republiquetas, preventing the royalists from strengthening their presence. After Simón Bolívar and Antonio José de Sucre defeated the royalists in northern South America, Sucre led a campaign that was to defeat the royalists in Charcas for good when the last royalist general, Pedro Antonio Olañeta, suffered death and defeat at the hands of his own defected forces at the Battle of Tumusla. Bolivian independence was proclaimed on 6 August 1825.",Bolivian War of Independence,1809-05-25T00:00:00Z,http://www.wikidata.org/entity/Q68475,,,,https://en.wikipedia.org/wiki/Bolivian_War_of_Independence
http://commons.wikimedia.org/wiki/Special:FilePath/Defensa%20de%20Montevideo.jpg,"The Uruguayan Civil War, also known in Spanish as the Guerra Grande (""Great War""), was a series of armed conflicts between the leaders of Uruguayan independence. While officially the war lasted from 1839 until 1851, it was a part of armed conflicts that started in 1832 and continued until the final military defeat of the Blancos faction in 1904.
Supporters of the two opposing presidents Rivera and Oribe formed two political parties: the Colorado Party and the National Party, both of which received backing and support from foreign sources, including neighboring Empire of Brazil, the Argentine Confederation, Buenos Aires Province as well as European powers, primarily the British Empire and the Kingdom of France, but also a legion of Italian volunteers including Giuseppe Garibaldi. The great diversity of nationalities among the military forces supporting the Colorado Party posed difficulties in arguing for their struggle in terms of a ""national liberation""; instead, the Colorado Party side argued that they were defending ""humanity"" and ""civilization"" against ""tyranny"".",Uruguayan Civil War,1839-01-01T00:00:00Z,http://www.wikidata.org/entity/Q2672972,,,,https://en.wikipedia.org/wiki/Uruguayan_Civil_War
http://commons.wikimedia.org/wiki/Special:FilePath/HekeFlagstaff.jpg,"The Flagstaff War, also known as  Heke's War, Hōne Heke's Rebellion and the Northern War, was fought between 11 March 1845 and 11 January 1846 in and around the Bay of Islands, New Zealand. The conflict is best remembered for the actions of Hōne Heke who challenged the authority of the British by cutting down the flagstaff on Flagstaff Hill (Maiki Hill) at Kororāreka (now Russell). The flagstaff had been a gift from Hōne Heke to James Busby, the first British Resident. The Northern War involved many major actions, including the Battle of Kororāreka on 11 March 1845, the Battle of Puketutu on 8 May 1845, the Battle of Ōhaeawai on 23 June 1845 and the siege of Ruapekapeka Pā from 27 December 1845 to 11 January 1846.",Flagstaff War,1846-01-11T00:00:00Z,http://www.wikidata.org/entity/Q2470023,,,"['United Kingdom', ' Māori']",https://en.wikipedia.org/wiki/Flagstaff_War
