image,summary_wikipedia,eventLabel,date,event,label,article,participants,article_en
http://commons.wikimedia.org/wiki/Special:FilePath/Confederacion%20war%20peru%20bolivia%20chile.png,"The War of the Confederation (Spanish: Guerra de la Confederación) was a military confrontation waged by the United Restoration Army, the alliance of the land and naval forces of Chile and the Restoration Army of Peru, formed in 1836 by Peruvian soldiers opposed to the confederation, and the Argentine Confederation against the Peru–Bolivian Confederation between 1836 and 1839. As a result of the Salaverry-Santa Cruz War, the Peru-Bolivia Confederation was created by General Andrés de Santa Cruz, which caused a power struggle in southern South America, with Chile and the Argentine Confederation, as both distrusted this new and powerful political entity, seeing their geopolitical interests threatened. After some incidents, Chile and the Argentine Confederation declared war on the Peru-Bolivian Confederation, although both waged war separately.
Chile since 1836 carried out the war with Peruvian dissidents who were enemies of Santa Cruz. During the war, one of Santa Cruz's subordinates, General Luis José de Orbegoso, rebelled against him in 1838 to restore Peru with a new government. However, by not allying with Chile, he ended up being defeated by Chilean forces. On the other hand, the Argentine Confederation did not achieve any significant advance between 1837 and 1838, paralyzing its war front and losing some territories north of Jujuy, not withstanding the importance for the Rosas government of the war against Bolivia as an instrument of political cohesion at the level of the Argentine Confederation, Rosas had enemies and problems on many fronts, among which it is worth mentioning the intrigues of the unitary emigrants in the Banda Oriental (Uruguay) and Chile, and the problem posed to the commercial interests of Buenos Aires by the conflict with France, which would soon lead to the French blockade of the Río de la Plata. Due to the presence of these multiple conflicts, Rosas could not divert his attention or his resources in the war he had decided against Bolivia. Finally, Chilean-Peruvian forces of the so-called Restorative Army led by General Manuel Bulnes, obtain a decisive victory in the battle of Yungay in 1839 while Andrés de Santa Cruz had been overthrown from the post of President of Bolivia by general José Miguel de Velasco who betrayed him before knowing the result of the battle. At the same time the general José Ballivián leaving the battlefield and mutinied in La Paz along with Bolivian reserve battalions. Also Colonel Guilarte, who had 700 soldiers in command, had abandoned his position and deserted without firing any shots. This battle caused the dissolution of the Peru-Bolivian Confederation, the exile of Santa Cruz, the restoration of Peru and Bolivia, among other consequences.
Historians have proposed different long-lasting effects of the war including the consolidation of the ideas of Peruvian and Chilean nationality.",War of the Confederation,1836-01-01T00:00:00Z,http://www.wikidata.org/entity/Q601811,,,"['Argentine Confederation', ' Chile', ' North Peru', ' Peru–Bolivian Confederation']",https://en.wikipedia.org/wiki/War_of_the_Confederation
http://commons.wikimedia.org/wiki/Special:FilePath/Japanese%20light%20tanks%20moving%20forward%20the%20front%20of%20the%20Khalkha%20River.jpg,"The Soviet–Japanese border conflicts, also known as the Soviet-Japanese Border War or the First Soviet-Japanese War, was a series of minor and major conflicts fought between the Soviet Union (led by Joseph Stalin), Mongolia (led by Khorloogiin Choibalsan) and Japan (led by Hirohito) in Northeast Asia from 1932 to 1939.
The Japanese expansion in Northeast China created a common border between the Japanese occupied ground and Soviet Far East. This led to growing tensions with the Soviet Union, with both sides often violating the border and accusing each other of border violations. The Soviets and Japanese, including their respective client states of Mongolia and Manchukuo, fought in a series of escalating small border skirmishes and punitive expeditions from 1935 until Soviet-Mongolian victory over the Japanese in the Battles of Khalkhin Gol in 1939 which resolved the dispute and returned the borders to status quo ante bellum.
The Soviet–Japanese border conflicts heavily contributed to the signing of the Soviet–Japanese Neutrality Pact in 1941.",Soviet–Japanese border conflicts,1932-01-01T00:00:00Z,http://www.wikidata.org/entity/Q696389,,,"['Soviet Union', ' Empire of Japan', "" Mongolian People's Republic""]",https://en.wikipedia.org/wiki/Soviet–Japanese_border_conflicts
http://commons.wikimedia.org/wiki/Special:FilePath/Josef%20%C5%A0nejd%C3%A1rek%20v%20Bansk%C3%A9%20%C5%A0tiavnici.jpg,,Hungarian-Czechoslovak War,1918-12-01T00:00:00Z,http://www.wikidata.org/entity/Q1747429,,,"['First Hungarian Republic', ' Hungarian Soviet Republic', ' First Czechoslovak Republic']",https://en.wikipedia.org/wiki/Hungarian–Czechoslovak_War
http://commons.wikimedia.org/wiki/Special:FilePath/3180969%20German%20Tornado%20in%20support%20of%20CJTF-Operation%20Inherent%20Resolve%20over%20Iraq%202017.jpg,The German intervention against the Islamic State (codenamed Operation Counter Daesh) was authorized on 4 December 2015. The involvement of the country in the Syrian Civil War and the War in Iraq (2013–2017) began with the Bundeswehr mission in Syria and Iraq to combat the terrorist organization Islamic State. The mission was primarily created as a reaction to the November 2015 Paris attacks.,German intervention against the Islamic State,2015-12-04T00:00:00Z,http://www.wikidata.org/entity/Q21647838,,,['Bundeswehr'],https://en.wikipedia.org/wiki/German_intervention_against_the_Islamic_State
http://commons.wikimedia.org/wiki/Special:FilePath/Desembarcoislasterceiras.jpg,"The War of the Portuguese Succession, a result of the extinction of the Portuguese royal line after the Battle of Alcácer Quibir and the ensuing Portuguese succession crisis of 1580, was fought from 1580 to 1583 between the two main claimants to the Portuguese throne: António, Prior of Crato, proclaimed in several towns as King of Portugal, and his first cousin Philip II of Spain, who eventually succeeded in claiming the crown, reigning as Philip I of Portugal.",War of the Portuguese Succession,1580-01-01T00:00:00Z,http://www.wikidata.org/entity/Q3298746,,,,https://en.wikipedia.org/wiki/War_of_the_Portuguese_Succession
http://commons.wikimedia.org/wiki/Special:FilePath/BattleOfBoyne.png,"The Williamite War in Ireland  took place from March 1689 to October 1691. Fought between supporters of James II and his successor, William III, it resulted in a Williamite victory. It is generally viewed as a related conflict of the 1688 to 1697 Nine Years' War.
In November 1688, the Glorious Revolution replaced the Catholic James with his Protestant daughter Mary II and her husband William, who ruled as joint monarchs of England, Ireland and Scotland. James retained considerable support in largely Catholic Ireland, where his supporters, known as Jacobites, hoped he would address long-standing grievances on land ownership, religion and civic rights. Most Irish Protestants fought for William, although some members of the Protestant Church of Ireland supported James.The war began in March 1689 with a series of skirmishes between James's Irish Army, which had stayed loyal in 1688, and Protestant militia. Fighting culminated in the siege of Derry, where the Jacobites failed to regain control of one of the north's key towns. This enabled William to land an expeditionary force, which defeated the main Jacobite army at the Boyne in July 1690. James returned to France after the battle, while the Jacobites were decisively defeated at Aughrim in 1691. The war ended with the Treaty of Limerick in October 1691.
One contemporary witness, George Story, calculated the war cost over 100,000 lives through sickness, famine, and in battle. Subsequent Jacobite risings were confined to Scotland and England, but the war was to have a lasting effect on the political and cultural landscape of Ireland, confirming British and Protestant rule over the country for over two centuries. While the Treaty of Limerick had offered a series of guarantees to Catholics, subsequent extension of the Penal Laws, particularly during the War of the Spanish Succession, would further erode their civic rights.",Williamite War in Ireland,1691-10-03T00:00:00Z,http://www.wikidata.org/entity/Q2320981,,,"['Dutch Republic', ' Kingdom of England', ' Kingdom of Scotland', ' Jacobitism', ' Kingdom of France']",https://en.wikipedia.org/wiki/Williamite_War_in_Ireland
http://commons.wikimedia.org/wiki/Special:FilePath/Johann%20Peter%20Krafft%20005.jpg,,Hundred Years' Croatian–Ottoman War,1493-01-01T00:00:00Z,http://www.wikidata.org/entity/Q3502774,,,"['Kingdom of Croatia', ' Ottoman Empire']",https://en.wikipedia.org/wiki/Hundred_Years'_Croatian–Ottoman_War
http://commons.wikimedia.org/wiki/Special:FilePath/Pequot%20war.jpg,"The Pequot War was an armed conflict that took place in 1636 and ended in 1638 in New England, between the Pequot tribe and an alliance of the colonists from the Massachusetts Bay, Plymouth, and Saybrook colonies and their allies from the Narragansett and Mohegan tribes. The war concluded with the decisive defeat of the Pequot. At the end, about 700 Pequots had been killed or taken into captivity. Hundreds of prisoners were sold into slavery to colonists in Bermuda or the West Indies; other survivors were dispersed as captives to the victorious tribes.
The result was the elimination of the Pequot tribe as a viable polity in southern New England, and the colonial authorities classified them as extinct. Survivors who remained in the area were absorbed into other local tribes.",Pequot War,1638-09-01T00:00:00Z,http://www.wikidata.org/entity/Q1207617,,,"['Pequot people', ' Connecticut Colony', ' Saybrook Colony', ' Mohegan', ' Narragansett people', ' Plymouth Colony', ' Massachusetts Bay Colony']",https://en.wikipedia.org/wiki/Pequot_War
http://commons.wikimedia.org/wiki/Special:FilePath/Navaro-dum-1037.png,"The War of the Three Sanchos (Spanish: Guerra de los Tres Sanchos) was a brief military conflict between three Spanish kingdoms in 1065–1067. The kingdoms were all ruled by Jiménez kings who were first cousins: Sancho II of Castile, Sancho IV of Navarre, and Sancho Ramírez of Aragon, all grandsons of Sancho the Great. The primary source for the war is the thirteenth-century Primera crónica general. 
The brief war was ignited in part by the strife left over from the division of the kingdom of Sancho the Great in 1035. That division had left Navarre with a supremacy over the ""petty kingdoms"" (regula) of Castile and Aragon, but by 1065 Navarre was a vassal of Castile (now joined with the Kingdom of León). In 1065 Ferdinand the Great, the Castilian monarch died and his kingdom was divided between his sons, with the eldest, Sancho, taking Castile. Sancho of Castile was covetous of the lands of Bureba and Alta Rioja. Ferdinand had helped reconquer them from the Caliphate, but then had ceded them to his elder brother García Sánchez III of Navarre, the father of Sancho IV. 
After an initial series of frontier raids, Sancho IV of Navarre asked for an alliance from Sancho Ramírez of Aragon. Most of the war took place in the region of Burgos and La Rioja. The war was also fought over Castile's ability to take part in the Reconquista, a capacity which had been diminished by the division of Ferdinand's kingdom in 1065. Sancho of Castile did try to extend his influence over the Muslim taifa of Zaragoza, which owed him parias. According to the twelfth-century Crónica Najerense, a battle was fought during which campaign his alférez, Rodrigo Díaz de Vivar, defeated his Navarrese counterpart, Jimeno Garcés, and gained the nickname campi doctor or ""master of the field [of battle]"", later to become famous in Spanish literature as el Campeador.Between August and September 1067 Sancho Ramírez led a counterattack against Castile. Tradition is divided over who had the victory, the Chronicle of San Juan de la Peña attributes a rout to the Navarrese and Aragonese at Viana, while the Primera crónica attributes victory to Sancho of Castile. Ramón Menéndez Pidal and Bernard F. Reilly accept the latter tradition, Reilly citing a donation of December 1167 to the monastery of Oña by a Flaino Oriolez dominator Tetelie, a landholder in the Trespaderna district of the upper Ebro Valley. The participation of a Castilian magnate from the Navarrese border in an act by which Sancho formally defined the jurisdiction of the Diocese of Oca (the only bishopric in Castile) strongly suggests that Sancho was in a strong position. The chronicler of San Juan de la Peña, a Navarrese source, wrote that Sancho of Castile was forced to raise the siege of Viana and flee on a horse bedecked only in its halter; that he subsequently convinced Abd ar-Rahman of Huesca to go to war with Aragon; and that Sancho Ramírez eventually made peace with him anyway. 
Castile retook Álava, the Montes de Oca, and Pancorvo, as well as Bureba and Alta Rioja, but the conflict ended in a stalemate 1067 when the death of Sancha of León, Ferdinand's widow, opened the way to war between Ferdinand's sons. The central issue in the conflict, the possession of the border territories, was resolved in 1076 when Sancho IV of Navarre was assassinated by his own brother and his kingdom partitioned between Sancho Ramírez of Aragon, who became king of Navarre as Sancho V, and Alfonso VI of León and Castile, who received the disputed lands.",War of the Three Sanchos,1065-01-01T00:00:00Z,http://www.wikidata.org/entity/Q1218354,,,,https://en.wikipedia.org/wiki/War_of_the_Three_Sanchos
http://commons.wikimedia.org/wiki/Special:FilePath/Italian%20campaigns%201796.JPG,"The French Revolutionary Wars continued from 1795, with the French in an increasingly strong position as members of the First Coalition made separate peaces. Austria and Great Britain were the main remaining members of the coalition. The rebellion in the Vendée was also finally terminated by General Hoche.
Mignet's History of the French Revolution states:

""The directory found the Rhine open towards Mainz, the war of La Vendée rekindled; the coasts of France and Holland threatened with a descent from England; lastly, the army of Italy destitute of everything, and merely maintaining the defensive under Schérer and Kellermann. Carnot prepared a new plan of campaign, which was to carry the armies of the republic to the very heart of the hostile states. Bonaparte, appointed general of the interior after the events of Vendémiaire, was placed at the head of the army of Italy; Jourdan retained the command of the army of the Sambre-et-Meuse, and Moreau had that of the army of the Rhine, in place of Pichegru. The latter, whose treason was suspected by the directory, though not proved, was offered the embassy to Sweden, which he refused, and retired to Arbois, his native place. The three great armies, placed under the orders of Bonaparte, Jourdan, and Moreau, were to attack the Austrian monarchy through Italy and Germany, combine at the entrance of the Tyrol and march upon Vienna, in echelon. The generals prepared to execute this vast movement, the success of which would make the republic mistress of the headquarters of the coalition on the continent.""",Campaigns of 1796 in the French Revolutionary Wars,1796-01-01T00:00:00Z,http://www.wikidata.org/entity/Q699511,,,,https://en.wikipedia.org/wiki/Campaigns_of_1796_in_the_French_Revolutionary_Wars
http://commons.wikimedia.org/wiki/Special:FilePath/Roubaud-Peter-in-Tarki.jpg,,Russo-Persian War of 1722–23,1723-09-12T00:00:00Z,http://www.wikidata.org/entity/Q1418582,,,,https://en.wikipedia.org/wiki/Russo-Persian_War_(1722–1723)
http://commons.wikimedia.org/wiki/Special:FilePath/PeoplesCrusadeMassacre.jpg,"The People's Crusade was the beginning phase of the First Crusade whose objective was to retake the Holy Land, and Jerusalem in particular, from Islamic rule. After in 1095 the head of the Roman Catholic Church Pope Urban II started to urge faithful Christians to undertake an armed pilgrimage to Jerusalem, the People's Crusade was conducted for roughly six months from April to October 1096. It is also known as the Peasants' Crusade, Paupers' Crusade or the Popular Crusade as it was executed by a mainly untrained peasant army prior to the main church-organized crusade. It was led primarily by Peter the Hermit with forces of Walter Sans Avoir. The peasant army of this crusade was destroyed by the forces of the Seljuk Turks under Kilij Arslan at the Battle of Civetot in northwestern Anatolia.  
The People's Crusade was the first, largest, and best documented of the popular crusades. The start of the more official and fully church-backed crusade, also called the ""Princes' Crusade"", occurred a few months later and was better organized, better armed, and better funded.",People's Crusade,1096-10-01T00:00:00Z,http://www.wikidata.org/entity/Q51650,,,,https://en.wikipedia.org/wiki/People's_Crusade
http://commons.wikimedia.org/wiki/Special:FilePath/Christian%20III%20of%20Denmark.jpg,"The Count's Feud (Danish: Grevens Fejde), also called the Count's War, was a war of succession that raged in Denmark in 1534–36 and brought about the Reformation in Denmark. In the international context, it was part of the European wars of religion. The Count's Feud takes its name from the Protestant Count Christopher of Oldenburg, who supported the Catholic King Christian II, deposed in 1523, over the election of Christian III, a staunch Protestant who had already implemented Lutheranism as the state religion in Schleswig and Holstein in 1528.",Count's Feud,1536-08-08T00:00:00Z,http://www.wikidata.org/entity/Q707364,,,,https://en.wikipedia.org/wiki/Count's_Feud
http://commons.wikimedia.org/wiki/Special:FilePath/2014-03-09%20-%20Perevalne%20military%20base%20-%200162.JPG,"In February and March 2014, Russia invaded the Crimean Peninsula, part of Ukraine, and then annexed it. This took place in the relative power vacuum immediately following the Revolution of Dignity and was the first act of the wider Russo-Ukrainian War.
The events in Kyiv that ousted Ukrainian president Viktor Yanukovych on 22 February 2014 sparked pro-Russian demonstrations as of 23 February against the incoming Ukrainian government. At the same time Russian president Vladimir Putin discussed Ukrainian events with security service chiefs remarking that ""we must start working on returning Crimea to Russia"". On 27 February, Russian troops seized strategic sites across Crimea, followed by the installation of the pro-Russian Aksyonov government in Crimea, the Crimean status referendum, and the declaration of Crimea's independence on 16 March 2014. Although Russia initially claimed their military was not involved in the events, Putin later admitted that troops were deployed to ""stand behind Crimea's self-defence forces"". Russia formally incorporated Crimea on 18 March 2014. Following the annexation, Russia escalated its  military presence on the peninsula and made threats to solidify the new status quo on the ground.Ukraine and many other countries condemned the annexation and consider it to be a violation of international law and Russian agreements safeguarding the territorial integrity of Ukraine. The annexation led to the other members of the G8 suspending Russia from the group and introducing sanctions. The United Nations General Assembly also rejected the referendum and annexation, adopting a resolution affirming the ""territorial integrity of Ukraine within its internationally recognised borders"", and referring to the Russian action as a ""temporary occupation"".The Russian government opposes the ""annexation"" label, with Putin defending the referendum as complying with the principle of the self-determination of peoples.",2014 Russian invasion of Crimea,2014-01-01T00:00:00Z,http://www.wikidata.org/entity/Q15833607,,,"['Armed Forces of Ukraine', ' Russian Armed Forces']",https://en.wikipedia.org/wiki/2014_Russian_invasion_of_Crimea
http://commons.wikimedia.org/wiki/Special:FilePath/Bangladesh%201971%20Liberation.jpg,"The Bangladesh Liberation War (Bengali: মুক্তিযুদ্ধ, pronounced [mukt̪iɟud̪d̪ʱo], also known as the Bangladesh War of Independence, or simply the Liberation War in Bangladesh) was a revolution and armed conflict sparked by the rise of the Bengali nationalist and self-determination movement in East Pakistan, which resulted in the independence of Bangladesh. The war began when the Pakistani military junta based in West Pakistan—under the orders of Yahya Khan—launched Operation Searchlight against the people of East Pakistan on the night of 25 March 1971, initiating the Bangladesh genocide.
In response to the violence, members of the Mukti Bahini—a guerrilla resistance movement formed by Bengali military, paramilitary and civilians—launched a mass guerrilla war against the Pakistani military, liberating numerous towns and cities in the war's initial months. At first, the Pakistan Army regained momentum during the monsoon, but Bengali guerrillas counterattacked by carrying out widespread sabotage, including through Operation Jackpot against the Pakistan Navy, while the nascent Bangladesh Air Force flew sorties against Pakistani military bases. India joined the war on 3 December 1971, after which Pakistan launched preemptive air strikes on northern India. The subsequent Indo-Pakistani War involved fighting on two fronts; with air supremacy achieved in the eastern theatre, and the rapid advance of the Allied Forces of Mukti Bahini and the Indian military, Pakistan surrendered in Dhaka on 16 December 1971, in what remains to date the largest surrender of armed personnel since the Second World War.Rural and urban areas across East Pakistan saw extensive military operations and air strikes to suppress the tide of civil disobedience that formed after the 1970 election stalemate. The Pakistan Army, backed by Islamists, created radical religious militias—the Razakars, Al-Badr and Al-Shams—to assist it during raids on the local populace. Members of the Pakistani military and supporting militias engaged in mass murder, deportation and genocidal rape, pursuing a systematic campaign of annihilation against nationalist Bengali civilians, students, intelligentsia, religious minorities and armed personnel. The capital, Dhaka, was the scene of numerous massacres, including the Dhaka University massacre. Sectarian violence also broke out between Bengalis and Urdu-speaking Biharis. An estimated 10 million Bengali refugees fled to neighbouring India, while 30 million were internally displaced.The war changed the geopolitical landscape of South Asia, with the emergence of Bangladesh as the world's seventh-most populous country. Due to complex regional alliances, the war was a major episode in Cold War tensions involving the United States, the Soviet Union and the People's Republic of China. The majority of member states in the United Nations recognised Bangladesh as a sovereign nation in 1972.",Bangladesh Liberation War,1971-12-16T00:00:00Z,http://www.wikidata.org/entity/Q371394,,,"['Pakistan', "" Provisional Government of the People's Republic of Bangladesh"", ' India']",https://en.wikipedia.org/wiki/Bangladesh_Liberation_War
